{
  "version": 2,
  "task_id": "github-gate-approval-integration-2026-07-23",
  "recorded_at": "2026-07-24T00:35:32.834294Z",
  "classification": "internal",
  "mode": "planning-review-only",
  "baseline_revision": "unresolved",
  "scope": "Design and implement a GitHub integration for Agentic SDLC gate approvals. The integration must preserve human-only approval authority, independent review, immutable evidence references, fail-closed behavior, and separation between lifecycle quality gates and mutation-oriented human gates. Define the GitHub API or Actions boundary, authentication, webhook/event handling, approval-to-run-record mapping, replay/idempotency protection, and tests. Do not approve gates, merge, deploy, or change persistent environments.",
  "dispatch_fingerprint": "sha256:a76a80756d28db39dd22737553168dd3874c2144383b5f9a08eedac67f4972d4",
  "disposition": "pending",
  "intent_record_id": null,
  "requirements_baseline_id": null,
  "current_lifecycle_phase": "intent",
  "knowledge_retrieval": {
    "status": "unavailable",
    "reason": "No portable knowledge source configured",
    "query_ids": [],
    "evidence_refs": [],
    "influence": "none"
  },
  "impact_profile": {
    "profile_id": "agents-impact",
    "status": "complete",
    "impact_categories": [],
    "specialized_boms": [],
    "blocking_unknowns": []
  },
  "lifecycle_gates": [
    {
      "tier": "lifecycle",
      "gate_id": "G1",
      "name": "Intent",
      "status": "pending",
      "applicability": "applicable",
      "applicability_rationale": "Lifecycle gate applies by default",
      "artifact_bindings": [],
      "preparers": [],
      "independent_verifier": null,
      "independence_declaration": {
        "verifier_confirmed_not_preparer": false,
        "verifier_made_material_correction": false
      },
      "authority_requirements": [
        {
          "authority_id": "code-reviewer",
          "authority_type": "independent-verifier",
          "role": "code-reviewer",
          "applicability": "applicable",
          "rationale": "Required by lifecycle gate contract"
        },
        {
          "authority_id": "product_owner",
          "authority_type": "human-approver",
          "role": "Product Owner",
          "applicability": "applicable",
          "rationale": "Assigned in project authority map"
        }
      ],
      "human_approvals": [],
      "decided_at": null,
      "evidence_refs": [],
      "knowledge_status": "unavailable",
      "findings": [],
      "exceptions": [],
      "invalidation_history": [],
      "required_reentry_gate": null
    },
    {
      "tier": "lifecycle",
      "gate_id": "G2",
      "name": "Requirements Baseline",
      "status": "pending",
      "applicability": "applicable",
      "applicability_rationale": "Lifecycle gate applies by default",
      "artifact_bindings": [],
      "preparers": [],
      "independent_verifier": null,
      "independence_declaration": {
        "verifier_confirmed_not_preparer": false,
        "verifier_made_material_correction": false
      },
      "authority_requirements": [
        {
          "authority_id": "code-reviewer",
          "authority_type": "independent-verifier",
          "role": "code-reviewer",
          "applicability": "applicable",
          "rationale": "Required by lifecycle gate contract"
        },
        {
          "authority_id": "product_owner",
          "authority_type": "human-approver",
          "role": "Product Owner",
          "applicability": "applicable",
          "rationale": "Assigned in project authority map"
        },
        {
          "authority_id": "engineering_lead",
          "authority_type": "human-approver",
          "role": "Engineering Lead",
          "applicability": "applicable",
          "rationale": "Assigned in project authority map"
        }
      ],
      "human_approvals": [],
      "decided_at": null,
      "evidence_refs": [],
      "knowledge_status": "unavailable",
      "findings": [],
      "exceptions": [],
      "invalidation_history": [],
      "required_reentry_gate": null
    },
    {
      "tier": "lifecycle",
      "gate_id": "G3",
      "name": "Architecture",
      "status": "pending",
      "applicability": "applicable",
      "applicability_rationale": "Lifecycle gate applies by default",
      "artifact_bindings": [],
      "preparers": [],
      "independent_verifier": null,
      "independence_declaration": {
        "verifier_confirmed_not_preparer": false,
        "verifier_made_material_correction": false
      },
      "authority_requirements": [
        {
          "authority_id": "code-reviewer",
          "authority_type": "independent-verifier",
          "role": "code-reviewer",
          "applicability": "applicable",
          "rationale": "Required by lifecycle gate contract"
        },
        {
          "authority_id": "system_architect",
          "authority_type": "human-approver",
          "role": "System Architect",
          "applicability": "applicable",
          "rationale": "Assigned in project authority map"
        }
      ],
      "human_approvals": [],
      "decided_at": null,
      "evidence_refs": [],
      "knowledge_status": "unavailable",
      "findings": [],
      "exceptions": [],
      "invalidation_history": [],
      "required_reentry_gate": null
    },
    {
      "tier": "lifecycle",
      "gate_id": "G4",
      "name": "Governance and Data",
      "status": "pending",
      "applicability": "applicable",
      "applicability_rationale": "Lifecycle gate applies by default",
      "artifact_bindings": [],
      "preparers": [],
      "independent_verifier": null,
      "independence_declaration": {
        "verifier_confirmed_not_preparer": false,
        "verifier_made_material_correction": false
      },
      "authority_requirements": [
        {
          "authority_id": "compliance-reviewer",
          "authority_type": "independent-verifier",
          "role": "compliance-reviewer",
          "applicability": "applicable",
          "rationale": "Required by lifecycle gate contract"
        },
        {
          "authority_id": "governance_lead",
          "authority_type": "human-approver",
          "role": "Governance Lead",
          "applicability": "applicable",
          "rationale": "Assigned in project authority map"
        },
        {
          "authority_id": "data_control_owner",
          "authority_type": "human-approver",
          "role": "Data/Control Owner",
          "applicability": "not-applicable",
          "rationale": "This repository does not control regulated application data; it contains agent-suite source and tooling only."
        }
      ],
      "human_approvals": [],
      "decided_at": null,
      "evidence_refs": [],
      "knowledge_status": "unavailable",
      "findings": [],
      "exceptions": [],
      "invalidation_history": [],
      "required_reentry_gate": null
    },
    {
      "tier": "lifecycle",
      "gate_id": "G5",
      "name": "Security and Crypto",
      "status": "pending",
      "applicability": "applicable",
      "applicability_rationale": "Lifecycle gate applies by default",
      "artifact_bindings": [],
      "preparers": [],
      "independent_verifier": null,
      "independence_declaration": {
        "verifier_confirmed_not_preparer": false,
        "verifier_made_material_correction": false
      },
      "authority_requirements": [
        {
          "authority_id": "security-reviewer",
          "authority_type": "independent-verifier",
          "role": "security-reviewer",
          "applicability": "applicable",
          "rationale": "Required by lifecycle gate contract"
        },
        {
          "authority_id": "security_lead",
          "authority_type": "human-approver",
          "role": "Security Lead",
          "applicability": "applicable",
          "rationale": "Assigned in project authority map"
        },
        {
          "authority_id": "human_key_owner",
          "authority_type": "human-approver",
          "role": "Human Key Owner",
          "applicability": "not-applicable",
          "rationale": "This repository does not own human cryptographic key material or key-management operations."
        }
      ],
      "human_approvals": [],
      "decided_at": null,
      "evidence_refs": [],
      "knowledge_status": "unavailable",
      "findings": [],
      "exceptions": [],
      "invalidation_history": [],
      "required_reentry_gate": null
    },
    {
      "tier": "lifecycle",
      "gate_id": "G6",
      "name": "Verification and Test",
      "status": "pending",
      "applicability": "applicable",
      "applicability_rationale": "Lifecycle gate applies by default",
      "artifact_bindings": [],
      "preparers": [],
      "independent_verifier": null,
      "independence_declaration": {
        "verifier_confirmed_not_preparer": false,
        "verifier_made_material_correction": false
      },
      "authority_requirements": [
        {
          "authority_id": "test-engineer",
          "authority_type": "independent-verifier",
          "role": "test-engineer",
          "applicability": "applicable",
          "rationale": "Required by lifecycle gate contract"
        },
        {
          "authority_id": "engineering_lead",
          "authority_type": "human-approver",
          "role": "Engineering Lead",
          "applicability": "applicable",
          "rationale": "Assigned in project authority map"
        },
        {
          "authority_id": "uat_product_owner",
          "authority_type": "human-approver",
          "role": "Product Owner",
          "applicability": "not-applicable",
          "rationale": "This repository does not implement a product user-acceptance workflow."
        }
      ],
      "human_approvals": [],
      "decided_at": null,
      "evidence_refs": [],
      "knowledge_status": "unavailable",
      "findings": [],